<?xml version="1.0" encoding="utf-8" ?>
<!DOCTYPE Defs SYSTEM "defs.dtd">
<Defs>
    <!--====================================== Carpets
======================================== -->
    <ThingDef ParentName="PlantBase">
        <defName>Plant_Grass</defName>
        <label>grass</label>
        <description>Wild grass. Grows anywhere there is a little light and minimally fertile ground.</description>
        <statBases>
            <MaxHitPoints>85</MaxHitPoints>
            <Flammability>1.3</Flammability>
            <Nutrition>0.50</Nutrition>
        </statBases>
        <graphicData>
            <textPath>Things/Plant/Grass</textPath>
            <graphicClass>Graphic_Random</graphicClass>
        </graphicData>
        <hideAtSnowDepth>0.5</hideAtSnowDepth>
        <ingestible />
        <plant>
            <fertilityMin>0.05</fertilityMin>
            <fertilitySensitivity>0.3</fertilitySensitivity>
            <growDays>2.5</growDays>
            <leaflessGraphicPath>Things/Plant/Grass_Leafless</leaflessGraphicPath>
            <harvestWork>40</harvestWork>
            <maxMeshCount>9</maxMeshCount>
            <visualSizeRange>0.4~0.6</visualSizeRange>
            <topWindExposure>0.4</topWindExposure>
            <wildOrder>1</wildOrder>
        </plant>
    </ThingDef>
    <ThingDef ParentName="PlantBase">
        <defName>Plant_TallGrass</defName>
        <label>tall grass</label>
        <description>Wild tall grass. Slows down anyone moving over it.</description>
        <statBases>
            <MaxHitPoints>90</MaxHitPoints>
            <Flammability>1.3</Flammability>
            <Nutrition>0.50</Nutrition>
        </statBases>
        <pathCost>14</pathCost>
        <graphicData>
            <textPath>Things/Plant/Grass</textPath>
            <graphicClass>Graphic_Random</graphicClass>
        </graphicData>
        <hideAtSnowDepth>0.5</hideAtSnowDepth>
        <ingestible />
        <plant>
            <fertilitySensitivity>0.7</fertilitySensitivity>
            <growDays>3</growDays>
            <harvestWork>60</harvestWork>
            <maxMeshCount>9</maxMeshCount>
            <visualSizeRange>0.7~0.85</visualSizeRange>
            <topWindExposure>0.4</topWindExposure>
            <wildClusterRadius>4</wildClusterRadius>
            <wildClusterWeight>10</wildClusterWeight>
            <wildOrder>1</wildOrder>
        </plant>
    </ThingDef>
    <!--====================================== Bushes
======================================== -->
    <ThingDef ParentName="BushBase">
        <defName>Plant_Bush</defName>
        <label>bush</label>
        <description>A short shrub. Does not typically talk.</description>
        <graphicData>
            <textPath>Things/Plant/Bush</textPath>
            <drawSize>1.15</drawSize>
            <shadowData>
                <volume>(0.55, 0.2, 0.2)</volume>
            </shadowData>
        </graphicData>
        <uiIconScale>0.85</uiIconScale>
        <plant>
            <growDays>3</growDays>
            <leaflessGraphicPath>Things/Plant/Bush_Leafless</leaflessGraphicPath>
        </plant>
    </ThingDef>
</Defs>